Sender,Subject,Email Text,Category,Short Remark
Mobashira khan <mknabila896@gmail.com>,Urgent,This product needs to return,urgent,The email subject and content indicate immediate action is needed for product return.
Goggles4u <support@news.goggles4u.com>,Hey 👓A little surprise inside for your eyes,"96 *{box-sizing:border-box}body{margin:0;padding:0}a[x-apple-data-detectors]{color:inherit!important;text-decoration:inherit!important}#MessageViewBody a{color:inherit;text-decoration:none}p{line-height:inherit}.desktop_hide,.desktop_hide table{mso-hide:all;display:none;max-height:0;overflow:hidden}.image_block img+div{display:none}sub,sup{font-size:75%;line-height:0} @media (max-width:695px){.row-content{width:100%!important}.stack .column{width:100%;display:block}.mobile_hide{min-height:0;max-",important,"The email contains marketing content and a surprise offer, which is relevant but not urgent."
Codecademy <learn@itr.mail.codecademy.com>,📢 Sale extended — 50% off Pro,"We're giving you more time to save on Pro. SALE EXTENDED 50% off Pro Hate missing a sale? Now you have one more chance to save 50% on a Pro annual plan. With it, you get to: * Build in-demand skills in AI, data, cybersecurity, & more * Apply what you learn in interactive lessons and projects * Learn by building working prototypes with our AI Builder * Prep for top industry certifications from AWS, CompTIA, & Microsoft * and so much more! Save 50% Structure your growth Enroll in a career path to ",important,This email contains a promotional offer that might be relevant and beneficial.
"""LEGO® News"" <Noreply@e.crm.lego.com>","Mohammad Jahidul, get the new LEGO® Insiders app",LEGO https://click.e.crm.lego.com/?qs=ABB7InYiOjEsImQiOjQ4ODF9ADIAAAAAAG-cMp4Vfz_KRMRRyL-FJKwVQhn8hJXKKwln_6htSSgnl8XGho2NfvT88lRX_9TvsP4A7iln9Nrzgo63YHv7TcSSr-IpWuB7DAh7-pcer5VCtlcB View online | https://click.e.crm.lego.com/?qs=ABB7InYiOjEsImQiOjQ4ODF9ADIAAAAAAG-cMp4W1LAHKE2Kc8k-NldW1IWi9GBTBwb46UQ48VRX9ABuLuG4syMgrg6HeCn9UzmtvjKJnaZbRBr7a_29X3nGJRj-wijvnXOWy5_1Llzx5rGz My Account https://click.e.crm.lego.com/?qs=ABB7InYiOjEsImQiOjQ4ODF9ADIAAAAAAG-cMp4YVGKzMJnF3baDYtvjO2obAUPKm-iYxlZHYdSHHCDdZ,important,This email announces the new LEGO Insiders app and contains relevant links for the recipient.
Indeed <donotreply@jobalert.indeed.com>,1 new franco manca job in London,"Indeed Job Alert 1 new franco manca job in London Jobs 1-1 of 1 new job See matching results on Indeed: https://uk.indeed.com/jobs?q=franco+manca&hl=en&from=ja&l=London&radius=25&alid=6332b8bc8cde620ce7e47b5c&tmtk=1jovi55q0ga23802&utm_campaign=job_alerts&utm_medium=email&utm_source=jobseeker_emails&of=1&fr=t Restaurant Team Member Franco Manca - London £12.71 an hour Easily apply to this job Help maintain high standards of cleanliness, food quality and presentation. We’re looking for someone wit",important,Job alert email that may require the recipient's attention.
